{
  "schema": "specnav.verification.repair-baseline.v1",
  "id": "repair-baseline-minimal",
  "failure_id": "failure-minimal",
  "change_id": "change-v2",
  "repair_link_id": "repair-minimal",
  "repair_link_digest": "aaaaaaaaaaaaaaaaaaaaaaaaaaaaaaaaaaaaaaaaaaaaaaaaaaaaaaaaaaaaaaaa",
  "before_identity": {
    "case_snapshot_hash": "aaaaaaaaaaaaaaaaaaaaaaaaaaaaaaaaaaaaaaaaaaaaaaaaaaaaaaaaaaaaaaaa",
    "code_sha": "1111111111111111111111111111111111111111",
    "test_sha": "2222222222222222222222222222222222222222",
    "environment_hash": "dddddddddddddddddddddddddddddddddddddddddddddddddddddddddddddddd",
    "runtime_version": "1.0.0",
    "kernel_version": "2.0.0"
  },
  "git_revision": "1111111111111111111111111111111111111111",
  "recorded_at": "2026-07-31T00:00:04Z"
}
